{
  "schemaVersion": 1,
  "rulesetVersion": 2,
  "updatedAt": "2026-09-07T00:00:00Z",
  "sites": [
    {
      "id": "youtube-demo",
      "name": "YouTube (v0, best effort, unverified against research)",
      "matches": ["*://*.youtube.com/*"],
      "features": [
        {
          "id": "youtube-demo.comments",
          "name": "Hide comments on video pages",
          "defaultEnabled": true,
          "hide": ["#comments"]
        },
        {
          "id": "youtube-demo.home-feed",
          "name": "Hide the home page recommendation grid",
          "summary": "Best effort selector, not yet checked against the selector research. Verify before shipping.",
          "defaultEnabled": false,
          "appliesTo": ["/", "/?*"],
          "hide": ["ytd-rich-grid-renderer"]
        },
        {
          "id": "youtube-demo.up-next",
          "name": "Hide the up next sidebar on video pages",
          "summary": "Best effort selector, not yet checked against the selector research. Verify before shipping.",
          "defaultEnabled": false,
          "hide": ["ytd-watch-next-secondary-results-renderer"]
        }
      ]
    }
  ]
}
